{
  "$schema": "http://json-schema.org/draft-07/schema#",
  "title": "EventBridgeEvent",
  "type": "object",
  "properties": {
    "version": {
      "type": "string"
    },
    "id": {
      "type": "string"
    },
    "detail-type": {
      "type": "string"
    },
    "source": {
      "type": "string"
    },
    "account": {
      "type": "string"
    },
    "time": {
      "type": "string",
      "format": "date-time"
    },
    "region": {
      "type": "string"
    },
    "resources": {
      "type": "array",
      "items": {
        "type": "string"
      }
    },
    "detail": {
      "type": "object",
      "additionalProperties": true
    }
  },
  "additionalProperties": false
}